{
  "schema_version": 1,
  "action_id": "software.check",
  "action_version": "1.0.0",
  "mode": "read",
  "enabled": true,
  "parameter_schema": {"type": "object", "properties": {"software_id": {"type": "string"}}, "required": ["software_id"], "additionalProperties": false},
  "target_kinds": ["server"],
  "platform_constraints": ["linux"],
  "policy_refs": [],
  "adapter_ref": "actions/software-check",
  "prechecks": ["target-resolved"],
  "postchecks": ["fact-written"],
  "recovery_requirement": "none",
  "reentrancy": "read_only",
  "timeout_seconds": 120,
  "sensitive_output": false,
  "credential_requirements": []
}
